{
  "schema_version": 1,
  "response_id": "88888888-8888-4888-8888-888888888888",
  "status": "accepted",
  "incident": {
    "schema_version": 1,
    "incident_id": "66666666-6666-4666-8666-666666666666",
    "user_id": "demo-user-1",
    "kind": "fall",
    "state": "escalating",
    "trigger_event_id": "55555555-5555-4555-8555-555555555555",
    "location": {
      "latitude": 41.8781,
      "longitude": -87.6298,
      "horizontal_accuracy_m": 8.0,
      "captured_at": "2026-07-18T14:32:05Z"
    },
    "simulated": false,
    "health_snapshot_id": "dddddddd-dddd-4ddd-8ddd-dddddddddddd",
    "opened_at": "2026-07-18T14:32:06Z",
    "updated_at": "2026-07-18T14:32:16Z",
    "verification_expires_at": "2026-07-18T14:32:36Z",
    "resolved_at": null,
    "state_version": 2
  },
  "transition": {
    "schema_version": 1,
    "transition_id": "77777777-7777-4777-8777-777777777777",
    "incident_id": "66666666-6666-4666-8666-666666666666",
    "sequence": 2,
    "from_state": "verifying",
    "to_state": "escalating",
    "trigger": "check_in_help",
    "occurred_at": "2026-07-18T14:32:16Z",
    "source_event_id": null,
    "check_in_id": "88888888-8888-4888-8888-888888888888",
    "simulated": false
  },
  "server_received_at": "2026-07-18T14:32:16Z"
}
